Year-Month,Agency Number,Agency Name,Cardholder Last Name,Cardholder First Initial,Description,Amount,Vendor,Transaction Date,Posted Date,Merchant Category Code (MCC)
201308,1000,OKLAHOMA STATE UNIVERSITY,BLOCK,J,GENERAL PURCHASE,2198.19,SOUTHERN PROSTHETIC SU,08/27/2013 12:00:00 AM,08/28/2013 12:00:00 AM,ORTHOPEDIC GOODS AND PROSTHETIC DEVICES
201308,1000,OKLAHOMA STATE UNIVERSITY,BLOCK,J,GENERAL PURCHASE,45.89,UNIVERSAL SEWING SUPPL,08/15/2013 12:00:00 AM,08/19/2013 12:00:00 AM,NON-DURABLE GOODS NOT ELSEWHERE CLASSIFIED
201312,1000,OKLAHOMA STATE UNIVERSITY,BLOCK,J,GENERAL PURCHASE,919.7,SOUTHERN PROSTHETIC SU,12/03/2013 12:00:00 AM,12/04/2013 12:00:00 AM,ORTHOPEDIC GOODS AND PROSTHETIC DEVICES
201403,1000,OKLAHOMA STATE UNIVERSITY,BLOCK,J,GENERAL PURCHASE,675.0,PRIMECARE OP,03/25/2014 12:00:00 AM,03/26/2014 12:00:00 AM,MEDICAL SERVICES & HEALTH PRACTITIONERS NOT ELSEWHERE CL
201404,1000,OKLAHOMA STATE UNIVERSITY,BLOCK,J,GENERAL PURCHASE,615.96,SOUTHERN PROSTHETIC SU,04/24/2014 12:00:00 AM,04/25/2014 12:00:00 AM,ORTHOPEDIC GOODS AND PROSTHETIC DEVICES
201405,1000,OKLAHOMA STATE UNIVERSITY,BLOCK,J,GENERAL PURCHASE,250.0,MUSKOGEE CHAMBER OF COMME,05/14/2014 12:00:00 AM,05/15/2014 12:00:00 AM,"CIVIC,SOCIAL AND FRATERNAL ASSOCIATIONS"
