Year-Month,Agency Number,Agency Name,Cardholder Last Name,Cardholder First Initial,Description,Amount,Vendor,Transaction Date,Posted Date,Merchant Category Code (MCC)
201307,76000,UNIVERSITY OF OKLAHOMA,CRAWFORD,P,GENERAL PURCHASE,95.0,BACKWOODS,07/06/2013 12:00:00 AM,07/08/2013 12:00:00 AM,SPORTING GOODS STORES
201309,76000,UNIVERSITY OF OKLAHOMA,CRAWFORD,P,Educational Services EA,721.29,ACORN NATURALISTS,09/03/2013 12:00:00 AM,09/04/2013 12:00:00 AM,SCHOOLS AND EDUCATIONAL SERVICES NOT ELSEWHERE CLASSIFIED
201309,76000,UNIVERSITY OF OKLAHOMA,CRAWFORD,P,GENERAL PURCHASE,240.0,AMERICAN PATCH AND EMBLEM,09/23/2013 12:00:00 AM,09/24/2013 12:00:00 AM,"SEWING,NEEDLEWORK,FABRIC AND PIECE GOODS STORES"
201311,76000,UNIVERSITY OF OKLAHOMA,CRAWFORD,P,GENERAL PURCHASE,95.84,ATW OF NORMAN # 20,11/04/2013 12:00:00 AM,11/05/2013 12:00:00 AM,MISCELLANEOUS AND SPECIALTY RETAIL STORES
201311,76000,UNIVERSITY OF OKLAHOMA,CRAWFORD,P,Educational Services EA,74.85,ACORN NATURALISTS,11/25/2013 12:00:00 AM,11/26/2013 12:00:00 AM,SCHOOLS AND EDUCATIONAL SERVICES NOT ELSEWHERE CLASSIFIED
201311,76000,UNIVERSITY OF OKLAHOMA,CRAWFORD,P,Educational Services EA,361.58,ACORN NATURALISTS,11/21/2013 12:00:00 AM,11/22/2013 12:00:00 AM,SCHOOLS AND EDUCATIONAL SERVICES NOT ELSEWHERE CLASSIFIED
201312,76000,UNIVERSITY OF OKLAHOMA,CRAWFORD,P,MAGISCOPE W/LUMIROD ILLUMI PCE|FIELD CASE FOR MAGI,385.64,FORESTRY SUPPLIERS,12/10/2013 12:00:00 AM,12/12/2013 12:00:00 AM,MISCELLANEOUS AND SPECIALTY RETAIL STORES
201403,76000,UNIVERSITY OF OKLAHOMA,CRAWFORD,P,GENERAL PURCHASE,201.08,ATW OF NORMAN # 20,03/13/2014 12:00:00 AM,03/14/2014 12:00:00 AM,MISCELLANEOUS AND SPECIALTY RETAIL STORES
201406,76000,UNIVERSITY OF OKLAHOMA,CRAWFORD,P,Rite In The Rain Spiral No PCE|The Infotube - Outd,504.69,AMAZON MKTPLACE PMTS,06/09/2014 12:00:00 AM,06/10/2014 12:00:00 AM,BOOK STORES
