Year-Month,Agency Number,Agency Name,Cardholder Last Name,Cardholder First Initial,Description,Amount,Vendor,Transaction Date,Posted Date,Merchant Category Code (MCC)
201310,4000,DEPARTMENT OF AGRICULTURE,Tyler,R,GENERAL PURCHASE,53.95,LUMBER 2,10/14/2013 12:00:00 AM,10/15/2013 12:00:00 AM,LUMBER AND BUILDING MATERIALS STORES
201311,4000,DEPARTMENT OF AGRICULTURE,Tyler,R,GENERAL PURCHASE,24.95,FOX BUILDING SUPPL,11/22/2013 12:00:00 AM,11/25/2013 12:00:00 AM,CONSTRUCTION MATERIALS NOT ELSEWHERE CLASSIFIED
201312,4000,DEPARTMENT OF AGRICULTURE,Tyler,R,GENERAL PURCHASE,10.57,TARGET SPECIALTY PRODUCT,12/10/2013 12:00:00 AM,12/11/2013 12:00:00 AM,CHEMICALS AND ALLIED PRODUCTS NOT ELSEWHERE CLASSIFIED
201312,4000,DEPARTMENT OF AGRICULTURE,Tyler,R,POLYCONCRETE EA,6.26,THE HOME DEPOT 3908,12/11/2013 12:00:00 AM,12/13/2013 12:00:00 AM,HOME SUPPLY WAREHOUSE STORES
201401,4000,DEPARTMENT OF AGRICULTURE,Tyler,R,GENERAL PURCHASE,24.95,FARMERS GRAIN CO INC,01/06/2014 12:00:00 AM,01/07/2014 12:00:00 AM,"NURSERIES,LAWN AND GARDEN SUPPLY STORES"
201402,4000,"DEPARTMENT OF AGRICULTURE, FOOD, ANF FOR",Tyler,R,GENERAL PURCHASE,42.45,INT LUTHER MILL AND FARM,01/30/2014 12:00:00 AM,02/03/2014 12:00:00 AM,"MISC. AUTOMOTIVE,AIRCRAFT,AND FARM EQUIPMENT DEALERS"
