Year-Month,Agency Number,Agency Name,Cardholder Last Name,Cardholder First Initial,Description,Amount,Vendor,Transaction Date,Posted Date,Merchant Category Code (MCC),Class
201307,1000,OKLAHOMA STATE UNIVERSITY,Dobbs,S,GENERAL PURCHASE,28.89,STILLWATER MILLING COMP,07/16/2013 12:00:00 AM,07/17/2013 12:00:00 AM,MISCELLANEOUS AND SPECIALTY RETAIL STORES,V
201308,1000,OKLAHOMA STATE UNIVERSITY,Dobbs,S,1.25-QT ZINNIA 466865 EA,95.04,LOWES #00241,08/06/2013 12:00:00 AM,08/07/2013 12:00:00 AM,HOME SUPPLY WAREHOUSE STORES,V
201310,1000,OKLAHOMA STATE UNIVERSITY,Dobbs,S,GENERAL PURCHASE,69.98,TLF TED AND DEBBIE FLWR A,10/16/2013 12:00:00 AM,10/18/2013 12:00:00 AM,FLORISTS,V
201310,1000,OKLAHOMA STATE UNIVERSITY,Dobbs,S,GENERAL PURCHASE,45.0,BIG CREEK NURSERY,10/01/2013 12:00:00 AM,10/03/2013 12:00:00 AM,LANDSCAPING AND HORTICULTURAL SERVICES,V
201405,1000,OKLAHOMA STATE UNIVERSITY,Dobbs,S,2.25 GAL YUCCA ASSORTED EA,297.92,LOWES #00241,05/22/2014 12:00:00 AM,05/23/2014 12:00:00 AM,HOME SUPPLY WAREHOUSE STORES,V
201405,1000,OKLAHOMA STATE UNIVERSITY,Dobbs,S,GENERAL PURCHASE,207.64,TLC FLORIST & GREE,05/21/2014 12:00:00 AM,05/22/2014 12:00:00 AM,"NURSERIES,LAWN AND GARDEN SUPPLY STORES",V
201406,1000,OKLAHOMA STATE UNIVERSITY,Dobbs,S,GENERAL PURCHASE,38.84,STILLWATER MILLING COMP,06/03/2014 12:00:00 AM,06/04/2014 12:00:00 AM,MISCELLANEOUS AND SPECIALTY RETAIL STORES,V
