Year-Month,Agency Number,Agency Name,Cardholder Last Name,Cardholder First Initial,Description,Amount,Vendor,Transaction Date,Posted Date,Merchant Category Code (MCC)
201308,1000,OKLAHOMA STATE UNIVERSITY,Johnson,E,GENERAL PURCHASE,388.8,QUILL CORPORATION,08/14/2013 12:00:00 AM,08/16/2013 12:00:00 AM,"STATIONERY, OFFICE SUPPLIES, PRINTING AND WRITING PAPER"
201309,1000,OKLAHOMA STATE UNIVERSITY,Johnson,E,GENERAL PURCHASE,973.0,DEARINGER PRINTING & TROP,09/09/2013 12:00:00 AM,09/10/2013 12:00:00 AM,MISCELLANEOUS AND SPECIALTY RETAIL STORES
201311,1000,OKLAHOMA STATE UNIVERSITY,Johnson,E,READY INDEX 5 TAB COLOR 3 EA,42.78,STAPLES       00105288,11/04/2013 12:00:00 AM,11/06/2013 12:00:00 AM,"STATIONERY,OFFICE AND SCHOOL SUPPLY STORES"
201312,1000,OKLAHOMA STATE UNIVERSITY,Johnson,E,GENERAL PURCHASE,26.98,FIRELAKE DESIGNS,12/11/2013 12:00:00 AM,12/13/2013 12:00:00 AM,MISCELLANEOUS APPAREL AND ACCESSORY STORES
201312,1000,OKLAHOMA STATE UNIVERSITY,Johnson,E,GENERAL PURCHASE,800.0,PAYPAL  OSTS,12/10/2013 12:00:00 AM,12/11/2013 12:00:00 AM,PROFESSIONAL SERVICES NOT ELSEWHERE CLASSIFIED
201401,1000,OKLAHOMA STATE UNIVERSITY,Johnson,E,GENERAL PURCHASE,16.99,QUILL CORPORATION,01/15/2014 12:00:00 AM,01/17/2014 12:00:00 AM,"STATIONERY, OFFICE SUPPLIES, PRINTING AND WRITING PAPER"
201401,1000,OKLAHOMA STATE UNIVERSITY,Johnson,E,GENERAL PURCHASE,489.61,QUILL CORPORATION,01/14/2014 12:00:00 AM,01/16/2014 12:00:00 AM,"STATIONERY, OFFICE SUPPLIES, PRINTING AND WRITING PAPER"
201406,1000,OKLAHOMA STATE UNIVERSITY,Johnson,E,GENERAL PURCHASE,93.26,WM SUPERCENTER #4241,06/12/2014 12:00:00 AM,06/13/2014 12:00:00 AM,"GROCERY STORES,AND SUPERMARKETS"
201406,1000,OKLAHOMA STATE UNIVERSITY,Johnson,E,GENERAL PURCHASE,94.53,QUILL CORPORATION,05/29/2014 12:00:00 AM,06/02/2014 12:00:00 AM,"STATIONERY, OFFICE SUPPLIES, PRINTING AND WRITING PAPER"
