Year-Month,Agency Number,Agency Name,Cardholder Last Name,Cardholder First Initial,Description,Amount,Vendor,Transaction Date,Posted Date,Merchant Category Code (MCC),Class
201307,1000,OKLAHOMA STATE UNIVERSITY,Kuehn,R,SCM810 8-CHANNEL AUTOMATIC Ea|RKC800 XLR CONNECTOR,3483.87,B & H PHOTO-VIDEO.COM,06/27/2013 12:00:00 AM,07/01/2013 12:00:00 AM,DIRCT MARKETING/DIRCT MARKETERS--NOT ELSEWHERE CLASSIFIED,V
201308,1000,OKLAHOMA STATE UNIVERSITY,Kuehn,R,GENERAL PURCHASE,203.13,SPOT IMAGING,08/20/2013 12:00:00 AM,08/21/2013 12:00:00 AM,CAMERA AND PHOTOGRAPHIC SUPPLY STORES,V
201309,1000,OKLAHOMA STATE UNIVERSITY,Kuehn,R,CHAT.150.USB EA,323.52,GOVCNCTN,09/12/2013 12:00:00 AM,09/16/2013 12:00:00 AM,"COMPUTERS, COMPUTER PERIPHERAL EQUIPMENT, SOFTWARE",V
201311,1000,OKLAHOMA STATE UNIVERSITY,Kuehn,R,GENERAL PURCHASE,39.0,DRI EASEUS TODO BACKUP,11/14/2013 12:00:00 AM,11/18/2013 12:00:00 AM,COMPUTER NETWORK/INFORMATION SERVICES,V
201311,1000,OKLAHOMA STATE UNIVERSITY,Kuehn,R,Basic: Business Hours (5X1 PCE|Basic: Business Hou,71.4,DMI  DELL HIGHER EDUC,11/07/2013 12:00:00 AM,11/07/2013 12:00:00 AM,"COMPUTERS, COMPUTER PERIPHERAL EQUIPMENT, SOFTWARE",V
201401,1000,OKLAHOMA STATE UNIVERSITY,Kuehn,R,ProSupport: 4-Hour 7x24 On PCE|ProSupport Plus: 7x,4386.56,DMI  DELL HIGHER EDUC,01/23/2014 12:00:00 AM,01/23/2014 12:00:00 AM,"COMPUTERS, COMPUTER PERIPHERAL EQUIPMENT, SOFTWARE",V
201401,1000,OKLAHOMA STATE UNIVERSITY,Kuehn,R,GENERAL PURCHASE,742.5,CODEWORK INC.,01/16/2014 12:00:00 AM,01/20/2014 12:00:00 AM,"COMPUTERS, COMPUTER PERIPHERAL EQUIPMENT, SOFTWARE",V
201402,1000,OKLAHOMA STATE UNIVERSITY,Kuehn,R,GENERAL PURCHASE,1074.0,HAVERFORD SYSTEMS,02/03/2014 12:00:00 AM,02/04/2014 12:00:00 AM,MISCELLANEOUS AND SPECIALTY RETAIL STORES,V
201405,1000,OKLAHOMA STATE UNIVERSITY,Kuehn,R,5MM ADAPTER RING Ea,57.13,B & H PHOTO-VIDEO-MO/TO,05/16/2014 12:00:00 AM,05/19/2014 12:00:00 AM,DIRCT MARKETING/DIRCT MARKETERS--NOT ELSEWHERE CLASSIFIED,V
