Year-Month,Agency Number,Agency Name,Cardholder Last Name,Cardholder First Initial,Description,Amount,Vendor,Transaction Date,Posted Date,Merchant Category Code (MCC)
201310,76000,UNIVERSITY OF OKLAHOMA,MARTINEZ,L,GENERAL PURCHASE,2.99,APL APPLE ITUNES STORE,10/18/2013 12:00:00 AM,10/21/2013 12:00:00 AM,RECORD STORES
201310,76000,UNIVERSITY OF OKLAHOMA,MARTINEZ,L,GENERAL PURCHASE,19.09,WAL-MART #2734,10/23/2013 12:00:00 AM,10/24/2013 12:00:00 AM,"GROCERY STORES,AND SUPERMARKETS"
201310,76000,UNIVERSITY OF OKLAHOMA,MARTINEZ,L,I-SPIRE KYBRD WRST RCKER NMB|Bus Card Case w/Flap,276.63,OFFICE MAX,10/23/2013 12:00:00 AM,10/25/2013 12:00:00 AM,"STATIONERY,OFFICE AND SCHOOL SUPPLY STORES"
201311,76000,UNIVERSITY OF OKLAHOMA,MARTINEZ,L,GENERAL PURCHASE,36.97,BED BATH & BEYOND #231,11/20/2013 12:00:00 AM,11/22/2013 12:00:00 AM,MISCELLANEOUS HOME FURNISHING SPECIALTY STORES
201401,76000,UNIVERSITY OF OKLAHOMA,MARTINEZ,L,GENERAL PURCHASE,9.99,APL APPLE ITUNES STORE,01/23/2014 12:00:00 AM,01/24/2014 12:00:00 AM,RECORD STORES
201401,76000,UNIVERSITY OF OKLAHOMA,MARTINEZ,L,GENERAL PURCHASE,117.07,OFFICE MAX,01/08/2014 12:00:00 AM,01/13/2014 12:00:00 AM,"STATIONERY,OFFICE AND SCHOOL SUPPLY STORES"
201402,76000,UNIVERSITY OF OKLAHOMA,MARTINEZ,L,Energel Needle Rt Fine 3 NMB|Energel Needle Rt Fin,130.97,OFFICE MAX,02/15/2014 12:00:00 AM,02/17/2014 12:00:00 AM,"STATIONERY,OFFICE AND SCHOOL SUPPLY STORES"
201403,76000,UNIVERSITY OF OKLAHOMA,MARTINEZ,L,CD DVD Keepers 50pk Cool NMB|2.4X DVD+RW Spindle 2,142.53,OFFICE MAX,03/12/2014 12:00:00 AM,03/14/2014 12:00:00 AM,"STATIONERY,OFFICE AND SCHOOL SUPPLY STORES"
201406,76000,UNIVERSITY OF OKLAHOMA,MARTINEZ,L,HP 61 Ink Crtg Combo Pac NMB|WIPES CLOROX 3PK/35CT,376.93,OFFICE MAX,06/24/2014 12:00:00 AM,06/26/2014 12:00:00 AM,"STATIONERY,OFFICE AND SCHOOL SUPPLY STORES"
