Year-Month,Agency Number,Agency Name,Cardholder Last Name,Cardholder First Initial,Description,Amount,Vendor,Transaction Date,Posted Date,Merchant Category Code (MCC),Class
201308,1000,OKLAHOMA STATE UNIVERSITY,Raby,K,GENERAL PURCHASE,47.05,DYNATRONICS CORP,08/28/2013 12:00:00 AM,08/29/2013 12:00:00 AM,DENTAL/LABORATORY/MEDICAL/OPHTHALMIC HOSP EQIP AND SUP.,V
201308,1000,OKLAHOMA STATE UNIVERSITY,Raby,K,GENERAL PURCHASE,139.2,ALLEGRA PRINT & IMAGING,08/15/2013 12:00:00 AM,08/19/2013 12:00:00 AM,QUICK-COPY AND REPRODUCTION SERVICES,V
201312,1000,OKLAHOMA STATE UNIVERSITY,Raby,K,GENERAL PURCHASE,51.98,STRETCHING INC,12/03/2013 12:00:00 AM,12/04/2013 12:00:00 AM,RECREATION SERVICES--NOT ELSEWHERE CLASSIFIED,V
201312,1000,OKLAHOMA STATE UNIVERSITY,Raby,K,GENERAL PURCHASE,448.39,CENTER FOR POSTURAL CO,12/05/2013 12:00:00 AM,12/09/2013 12:00:00 AM,DOCTORS AND PHYSICIANS--NOT ELSEWHERE CLASSIFIED,V
201406,1000,OKLAHOMA STATE UNIVERSITY,Raby,K,GENERAL PURCHASE,100.23,DYNATRONICS CORP,06/21/2014 12:00:00 AM,06/23/2014 12:00:00 AM,DENTAL/LABORATORY/MEDICAL/OPHTHALMIC HOSP EQIP AND SUP.,V
201406,1000,OKLAHOMA STATE UNIVERSITY,Raby,K,GENERAL PURCHASE,-7.17,DYNATRONICS CORP,06/20/2014 12:00:00 AM,06/25/2014 12:00:00 AM,DENTAL/LABORATORY/MEDICAL/OPHTHALMIC HOSP EQIP AND SUP.,V
