Year-Month,Agency Number,Agency Name,Cardholder Last Name,Cardholder First Initial,Description,Amount,Vendor,Transaction Date,Posted Date,Merchant Category Code (MCC)
201309,1000,OKLAHOMA STATE UNIVERSITY,Ruhl,D,25 nmole DNA Oligo 1|25 nmole DNA Oligo 1|25 nmole,57.5,INTEGRATED DNA TECH,09/18/2013 12:00:00 AM,09/19/2013 12:00:00 AM,NON-DURABLE GOODS NOT ELSEWHERE CLASSIFIED
201401,1000,OKLAHOMA STATE UNIVERSITY,Ruhl,D,GENERAL PURCHASE,89.4,WAL-MART #0137,01/08/2014 12:00:00 AM,01/09/2014 12:00:00 AM,"GROCERY STORES,AND SUPERMARKETS"
201402,1000,OKLAHOMA STATE UNIVERSITY,Ruhl,D,GRACE'S INSECT MEDIUM INS EA|MINIMUM ESSENTIAL MED,268.82,SIGMA ALDRICH US,01/31/2014 12:00:00 AM,02/03/2014 12:00:00 AM,DIRCT MARKETING/DIRCT MARKETERS--NOT ELSEWHERE CLASSIFIED
201402,1000,OKLAHOMA STATE UNIVERSITY,Ruhl,D,NEWBORN CALF SERUM EA|INSULIN (HUMANRECOMBZN) A EA,509.63,SIGMA ALDRICH US,01/31/2014 12:00:00 AM,02/03/2014 12:00:00 AM,DIRCT MARKETING/DIRCT MARKETERS--NOT ELSEWHERE CLASSIFIED
201402,1000,OKLAHOMA STATE UNIVERSITY,Ruhl,D,RIBONUCLEASE A TYPE II-A EA|PROTEINASE K FROM TRIT,382.69,SIGMA ALDRICH US,01/31/2014 12:00:00 AM,02/03/2014 12:00:00 AM,DIRCT MARKETING/DIRCT MARKETERS--NOT ELSEWHERE CLASSIFIED
201402,1000,OKLAHOMA STATE UNIVERSITY,Ruhl,D,FILTER BTL TOP .2UM 500ML CS,60.9,VWR INTERNATIONAL INC,02/01/2014 12:00:00 AM,02/03/2014 12:00:00 AM,DENTAL/LABORATORY/MEDICAL/OPHTHALMIC HOSP EQIP AND SUP.
201402,1000,OKLAHOMA STATE UNIVERSITY,Ruhl,D,25 nmole DNA Oligo 1|25 nmole DNA Oligo 1|25 nmole,36.0,INTEGRATED DNA TECH,02/05/2014 12:00:00 AM,02/06/2014 12:00:00 AM,NON-DURABLE GOODS NOT ELSEWHERE CLASSIFIED
201404,1000,OKLAHOMA STATE UNIVERSITY,Ruhl,D,GENERAL PURCHASE,60.61,NATIONAL DIAGNOSTICS INC,04/01/2014 12:00:00 AM,04/03/2014 12:00:00 AM,CHEMICALS AND ALLIED PRODUCTS NOT ELSEWHERE CLASSIFIED
