Year-Month,Agency Number,Agency Name,Cardholder Last Name,Cardholder First Initial,Description,Amount,Vendor,Transaction Date,Posted Date,Merchant Category Code (MCC)
201308,1000,OKLAHOMA STATE UNIVERSITY,Stover,L,GENERAL PURCHASE,50.0,AMERICAN PHYSIOLOGICAL SO,08/20/2013 12:00:00 AM,08/22/2013 12:00:00 AM,MEMBERSHIP ORGANIZATIONS--NOT ELSEWHERE CLASSIFIED
201309,1000,OKLAHOMA STATE UNIVERSITY,Stover,L,STAPLES  8.5X11 COPY RM EA|DURABLE VIEW BINDER 2IN,154.99,STAPLES       00105288,09/20/2013 12:00:00 AM,09/23/2013 12:00:00 AM,"STATIONERY,OFFICE AND SCHOOL SUPPLY STORES"
201311,1000,OKLAHOMA STATE UNIVERSITY,Stover,L,GENERAL PURCHASE,25.16,HOBBY-LOBBY #0005,11/22/2013 12:00:00 AM,11/25/2013 12:00:00 AM,"HOBBY,TOY,AND GAME STORES"
201403,1000,OKLAHOMA STATE UNIVERSITY,Stover,L,INK AND TONER SAVINGS PASS EA|HP CC530A BLACK TONE,122.05,STAPLES       00105288,03/06/2014 12:00:00 AM,03/10/2014 12:00:00 AM,"STATIONERY,OFFICE AND SCHOOL SUPPLY STORES"
201403,1000,OKLAHOMA STATE UNIVERSITY,Stover,L,HP 305A CYAN TONER EA|HP 305A YELLOW TONER EA|HP 3,362.97,STAPLES       00105288,03/06/2014 12:00:00 AM,03/10/2014 12:00:00 AM,"STATIONERY,OFFICE AND SCHOOL SUPPLY STORES"
201406,1000,OKLAHOMA STATE UNIVERSITY,Stover,L,HP 305A BLACK TONER CARTRI EA,91.39,STAPLES DIRECT,06/12/2014 12:00:00 AM,06/13/2014 12:00:00 AM,"STATIONERY, OFFICE SUPPLIES, PRINTING AND WRITING PAPER"
201406,1000,OKLAHOMA STATE UNIVERSITY,Stover,L,COMMAND BRUSH NICKEL HOOK EA|IMAK KEYBOARDSUPPORT-,68.04,STAPLES       00105288,06/25/2014 12:00:00 AM,06/27/2014 12:00:00 AM,"STATIONERY,OFFICE AND SCHOOL SUPPLY STORES"
201406,1000,OKLAHOMA STATE UNIVERSITY,Stover,L,HR 2.7 CU FT COMP REF (+61 EA|GH 4-IN BROWN WEDGE,120.02,LOWES #00241,06/25/2014 12:00:00 AM,06/26/2014 12:00:00 AM,HOME SUPPLY WAREHOUSE STORES
