Year-Month,Agency Number,Agency Name,Cardholder Last Name,Cardholder First Initial,Description,Amount,Vendor,Transaction Date,Posted Date,Merchant Category Code (MCC),Class
201307,1000,OKLAHOMA STATE UNIVERSITY,Weaver,J,GENERAL PURCHASE,101.17,OAKWOOD PRODUCTS INC,07/11/2013 12:00:00 AM,07/12/2013 12:00:00 AM,CHEMICALS AND ALLIED PRODUCTS NOT ELSEWHERE CLASSIFIED,V
201307,1000,OKLAHOMA STATE UNIVERSITY,Weaver,J,2-MERCAPTOETHLAMINE HYDROC EA|1-METHLTHIO-1-METHLA,97.02,VWR INTERNATIONAL INC,07/11/2013 12:00:00 AM,07/11/2013 12:00:00 AM,DENTAL/LABORATORY/MEDICAL/OPHTHALMIC HOSP EQIP AND SUP.,V
201308,1000,OKLAHOMA STATE UNIVERSITY,Weaver,J,GENERAL PURCHASE,13.48,RADIOSHACK COR00194282,08/19/2013 12:00:00 AM,08/20/2013 12:00:00 AM,ELECTRONICS STORES,V
201309,1000,OKLAHOMA STATE UNIVERSITY,Weaver,J,GENERAL PURCHASE,69.78,IDEX HEALTH AND SCIENCE,09/03/2013 12:00:00 AM,09/04/2013 12:00:00 AM,INDUSTRIAL SUPPLIES NOT ELSEWHERE CLASSIFIED,V
201310,1000,OKLAHOMA STATE UNIVERSITY,Weaver,J,CYANURIC FLUORIDE 98% 5G EA,92.6,VWR INTERNATIONAL INC,10/19/2013 12:00:00 AM,10/21/2013 12:00:00 AM,DENTAL/LABORATORY/MEDICAL/OPHTHALMIC HOSP EQIP AND SUP.,V
201311,1000,OKLAHOMA STATE UNIVERSITY,Weaver,J,1/2-IN X 5-FT CPR TYPE L EA,10.47,LOWES #00241,11/19/2013 12:00:00 AM,11/20/2013 12:00:00 AM,HOME SUPPLY WAREHOUSE STORES,V
201401,1000,OKLAHOMA STATE UNIVERSITY,Weaver,J,GENERAL PURCHASE,2.49,RADIOSHACK COR00194282,01/29/2014 12:00:00 AM,01/30/2014 12:00:00 AM,ELECTRONICS STORES,V
